{
  "schema": "ucc.workspace-checkpoint",
  "schema_version": 1,
  "id": "snap_01K0A6R4V8W6E3M4M8Y0R9J2QW",
  "created_at": "2026-08-22T12:00:00.000Z",
  "created_by": "act_01K0A6R4V8W6E3M4M8Y0R9J2QA",
  "record_version": 1,
  "workspace_id": "col_01K0A6R4V8W6E3M4M8Y0R9J2QW",
  "checkpoint_hash": "sha256:0123456789abcdef0123456789abcdef0123456789abcdef0123456789abcdef",
  "content_reference": {
    "store_id": "ucc-workspace",
    "relative_path": "checkpoints/snap-1.tar",
    "content_hash": "sha256:0123456789abcdef0123456789abcdef0123456789abcdef0123456789abcdef"
  }
}
